<?xml version="1.0" encoding="UTF-8"?>
<!--
/**
 * Copyright Â© 2015 Magento. All rights reserved.
 * See COPYING.txt for license details.
 */
-->
<classmap xmlns:xs="http://www.w3.org/2001/XMLSchema-instance" xs:noNamespaceSchemaLocation="../../../../../etc/class-map.xsd">
    <rename>
        <from>catalog/product_attribute_backend_sku</from>
        <to>Magento\Catalog\Model\Product\Attribute\Backend\Sku</to>
    </rename>
    <rename>
        <from>customer/customer_attribute_backend_website</from>
        <to>Magento\Customer\Model\Customer\Attribute\Backend\Website</to>
    </rename>
    <rename>
        <from>customer/customer_attribute_source_website</from>
        <to>Magento\Customer\Model\Customer\Attribute\Source\Website</to>
    </rename>
</classmap>
